{
  "$schema": "https://json-schema.org/draft/2020-12/schema",
  "$id": "https://overlord.local/schemas/strategy-dsl/strategy_dry_run_readiness_checkpoint.schema.json",
  "title": "Overlord StrategyDryRunReadinessCheckpoint",
  "type": "object",
  "required": [
    "strategy_dry_run_readiness_checkpoint_id",
    "schema_version",
    "generated_at",
    "paper_only",
    "live_execution_allowed",
    "order_placement_allowed",
    "strategy_definition_id",
    "strategy_run_intent_id",
    "strategy_run_manifest_id",
    "strategy_run_evidence_bundle_id",
    "strategy_dry_run_plan_id",
    "strategy_dry_run_plan_evidence_summary_id",
    "source_strategy_definition_id",
    "source_strategy_run_intent_id",
    "source_strategy_run_manifest_id",
    "source_strategy_run_evidence_bundle_id",
    "source_strategy_dry_run_plan_id",
    "source_strategy_dry_run_plan_evidence_summary_id",
    "replay_mode",
    "run_mode",
    "prerequisite_artifacts",
    "readiness_checks",
    "readiness_status",
    "status",
    "reason"
  ],
  "additionalProperties": false,
  "properties": {
    "strategy_dry_run_readiness_checkpoint_id": { "type": "string", "pattern": "^sdrpc_" },
    "schema_version": { "const": "strategy_dry_run_readiness_checkpoint.v1" },
    "generated_at": { "type": "string", "format": "date-time" },
    "paper_only": { "const": true },
    "live_execution_allowed": { "const": false },
    "order_placement_allowed": { "const": false },
    "strategy_definition_id": { "type": "string", "pattern": "^sdef_" },
    "strategy_run_intent_id": { "type": "string", "pattern": "^sri_" },
    "strategy_run_manifest_id": { "type": "string", "pattern": "^srm_" },
    "strategy_run_evidence_bundle_id": { "type": "string", "pattern": "^sreb_" },
    "strategy_dry_run_plan_id": { "type": "string", "pattern": "^sdrp_" },
    "strategy_dry_run_plan_evidence_summary_id": { "type": "string", "pattern": "^sdrpes_" },
    "source_strategy_definition_id": { "type": "string", "pattern": "^sdef_" },
    "source_strategy_run_intent_id": { "type": "string", "pattern": "^sri_" },
    "source_strategy_run_manifest_id": { "type": "string", "pattern": "^srm_" },
    "source_strategy_run_evidence_bundle_id": { "type": "string", "pattern": "^sreb_" },
    "source_strategy_dry_run_plan_id": { "type": "string", "pattern": "^sdrp_" },
    "source_strategy_dry_run_plan_evidence_summary_id": { "type": "string", "pattern": "^sdrpes_" },
    "replay_mode": { "enum": ["offline_fixture_replay"] },
    "run_mode": { "enum": ["validation_only", "dry_run_planned"] },
    "prerequisite_artifacts": { "type": "array", "minItems": 1 },
    "readiness_checks": { "type": "array", "minItems": 1 },
    "readiness_status": { "enum": ["dry_run_ready", "dry_run_not_ready", "dry_run_readiness_unknown"] },
    "status": { "enum": ["dry_run_readiness_checkpoint_ready", "dry_run_readiness_checkpoint_rejected"] },
    "reason": { "type": "string" }
  }
}
